order_id,customer_id,date,nearest_warehouse,shopping_cart,order_price,delivery_charges,customer_lat,customer_long,coupon_discount,order_total,season,is_expedited_delivery,distance_to_nearest_warehouse,latest_customer_review,is_happy_customer
ORD398114,ID0775945874,2019-12-15,Thompson,"[('pearTV', 2), ('Candle Inferno', 1)]",13050.0,97.18,-37.806209,144.9594792,25,9884.68,Summer,True,1.3073,five stars very happy with seller and item,1.0
ORD414433,ID0030240834,2019-03-14,Thompson,"[('Lucent 330S', 1), ('Alcon 10', 1)]",10180.0,66.37,-37.80081660000001,144.9576,5,9737.37,Autumn,True,1.6124,this phone was not unlocked ! this phone was not unlocked!!!,0.0
ORD093983,ID1492145816,2019-06-29,Thompson,"[('Lucent 330S', 1), ('Alcon 10', 1), ('Candle Inferno', 2)]",11040.0,63.26,-37.813229,144.9514476,0,11103.26,Winter,False,0.39,"battery life it's a very beautiful phone. everything seems to work fine. just an issue, i find it that battery life drops very quickly. i have wifi and blutooth on most of the time, does that affect it? even if i'm not using it, battery drops like 10-15 % overnight.",1.0
ORD291094,ID0575524462,2019-11-25,Nickolson,"[('Toshika 750', 1), ('Olivia x460', 2), ('Thunder line', 2)]",11130.0,77.67,-37.8210055,144.9825937,15,9538.17,Spring,False,1.1779,light to carry and good picture quality. this was purchased for a hearing impaired person to download video in american sign language . this product was easy to maneuver for someone that was not use to a tablet.,1.0
ORD404626,ID2776664754,2019-02-13,Nickolson,"[('Alcon 10', 2), ('Lucent 330S', 1)]",19130.0,84.62,-37.824005,144.95599119999997,25,14432.12,Summer,True,1.3358,"garbage, refurbished is supposed to be to factory new ... garbage, refurbished is supposed to be to factory new specs, i was replacing this phone due to the poor battery performance on my old droid turbo this one is even worse. warning do not buy a refurbished phone.",0.0
ORD384268,ID3994640126,2019-05-13,Bakers,"[('Thunder line', 2), ('Candle Inferno', 2), ('pearTV', 1)]",11530.0,66.83,-37.798483000000004,144.9979935,5,11020.33,Autumn,False,1.3044,"comes with screen protector and clear case nothing, cheap alternative so universe s9",1.0
ORD196990,ID0356096427,2019-10-24,Bakers,"[('Universe Note', 2), ('iStream', 1)]",7050.0,88.27,-37.8190021,144.9919706,25,5375.77,Spring,True,1.0427,"avoid at all costs!!! this is the absolute worst phone i have ever owned (and it's the first ""smart phone"" i've ever bought.) it is painfully slow and only actually accomplishes a task (like sending a text, sending a photo, taking a picture, going on the internet) about half the time (the other half it just freezes or says ""cannot complete task"")",0.0
ORD034359,ID0052600140,2019-08-13,Thompson,"[('Toshika 750', 2), ('Candle Inferno', 2), ('Thunder line', 1)]",11680.0,80.46,-37.804212400000004,144.96037819999995,0,11760.46,Winter,True,1.5024,g great phone i enjoy having it and usind it,1.0
ORD449158,ID2180822307,2019-05-21,Nickolson,"[('pearTV', 1), ('iAssist Line', 2), ('Candle Inferno', 2), ('Toshika 750', 2)]",20260.0,79.43,-37.81688070000001,144.96150790000004,0,20339.43,Autumn,True,0.7326,five stars works great. very resilient,1.0
ORD279799,ID6167344525,2019-04-19,Nickolson,"[('Universe Note', 1), ('Toshika 750', 2)]",12090.0,77.94,-37.8137283,144.9686925,10,10958.94,Autumn,True,0.547,nice phone love it,1.0
ORD322095,ID4315827367,2019-09-01,Bakers,"[('iStream', 1), ('Universe Note', 2), ('Candle Inferno', 2), ('iAssist Line', 1)]",10135.0,58.47,-37.8126689,145.0002816,5,9686.72,Spring,False,0.5345,must have been aftermarket glass i had the phone about 2 weeks and the glass just split on the edge. never dropped it and it doesn't have a scratch. very fragile.,0.0
ORD324731,ID0780910234,2019-12-27,Thompson,"[('iStream', 2), ('Universe Note', 2)]",7200.0,62.83,-37.8037588,144.95634130000005,0,7262.83,Summer,False,1.2844,no sevice no service at my work place when i switched sim card over to the universe s7 from universe s6 edge. when i had service at my work when i had my universe s6 edge. contacted verizon and trouble shot it says trouble is with the phone. emailed the place where i bought the phone to tell them about the issue and no response.,0.0
ORD423540,ID0411688756,2019-11-12,Nickolson,"[('Candle Inferno', 1), ('pearTV', 2), ('Universe Note', 2)]",19950.0,75.32,-37.821723399999996,144.972568,25,15037.82,Spring,False,0.4378,"love it takes much better photos than my lucent g4 which it replaces... because the g4 went random on me and even a factory reset didn't help. the logic of operation is also more intuitive to a long-time pc user, and it is fast fast fast. and the battery lasts forever. very reliable and easy to use.",1.0
ORD235057,ID1725216465,2019-03-05,Thompson,"[('Universe Note', 1), ('Alcon 10', 1), ('iStream', 2), ('pearTV', 2)]",25320.0,69.27,-37.802282399999996,144.96222350000005,10,22857.27,Autumn,True,1.7647,cell wouldn't know anything about the cell phone i ordered because the person hasn't even shipped it yet. it's been a month! and digico has does nothing to help and really has nothing for an option to provide assistance.,0.0
ORD244168,ID6167344517,2019-07-21,Nickolson,"[('Alcon 10', 2), ('Thunder line', 1), ('Toshika 750', 1)]",24400.0,77.73,-37.810846500000004,144.9673634,5,23257.73,Winter,True,0.8837,"we like the battery endurance. the new 8"" screen is great too.",1.0
ORD019283,ID4716795448,2019-09-24,Thompson,"[('iAssist Line', 1), ('Candle Inferno', 2), ('Universe Note', 2), ('Toshika 750', 2)]",18625.0,77.68,-37.8188376,144.9533842,0,18702.68,Spring,False,0.8828,"quite a good opportunity. excellent, and a great product. i highly recommend it.",1.0
ORD010875,ID4326586189,2019-06-20,Nickolson,"[('Olivia x460', 1), ('Thunder line', 1), ('Toshika 750', 2), ('Alcon 10', 2)]",29945.0,68.88,-37.8102612,144.96141459999996,15,25522.13,Winter,False,1.1716,very nice phone. works as advertised very nice phone. works as advertised. the person using it is a newbie to smart phones and very basic with pc's in general so this is like the future! :-),1.0
ORD476331,ID1224854732,2019-02-17,Thompson,"[('Candle Inferno', 2), ('pearTV', 1), ('Alcon 10', 1), ('Universe Note', 2)]",23020.0,54.29,-37.8139185,144.93963689999995,10,20772.29,Summer,False,0.6681,junk dropped it 2' and screen is shot!,0.0
ORD045035,ID0233275028,2019-08-06,Bakers,"[('iAssist Line', 2), ('pearTV', 2), ('Alcon 10', 2), ('Olivia x460', 1)]",36195.0,84.02,-37.8002338,144.9770628,25,27230.27,Winter,True,1.9325,great value great phone. awesome camera.,1.0
ORD494366,ID0265516842,2019-01-24,Nickolson,"[('Thunder line', 1), ('Alcon 10', 1), ('Lucent 330S', 2)]",13590.0,70.41,-37.8217141,144.9738554,10,12301.41,Summer,False,0.5136,fantastic this is exactly what i wanted. the seller was fantastic. i was having some a challenge because im not phone literate and he was very patient and very helpful.,1.0
ORD068854,ID1224854817,2019-11-04,Thompson,"[('Candle Inferno', 1), ('Universe Note', 1)]",3880.0,85.71,-37.8131243,144.9401031,0,3965.71,Spring,True,0.6146,"not pear it’s not a pear product, it’s a clone and at that price schould be pear product i’m. returning this",0.0
ORD216818,ID0356096365,2019-08-06,Bakers,"[('Thunder line', 2), ('iAssist Line', 2)]",8810.0,53.05,-37.8191587,144.9932373,15,7541.55,Winter,False,1.0349,faulty phone still nobody contacted me,0.0
ORD229625,ID0781093879,2019-01-29,Thompson,"[('Olivia x460', 1), ('Alcon 10', 1), ('Thunder line', 2)]",14535.0,61.66,-37.8023973,144.9433432,10,13143.16,Summer,False,1.1899,bad out the box the phone would not go pass the activation screen. i sent it back the same day,0.0
ORD233965,ID5957906915,2019-07-10,Nickolson,"[('Alcon 10', 1), ('Toshika 750', 2), ('iAssist Line', 2)]",22040.0,80.59999999999854,-37.8041039,144.9738665,25,16610.6,Winter,True,1.6572,love it. very happy with this phone.,1.0
ORD472026,ID0767665001,2019-06-20,Nickolson,"[('iAssist Line', 2), ('Toshika 750', 2), ('Universe Note', 2)]",19990.0,63.59,-37.8079659,144.9733709,5,19054.09,Winter,True,1.23,hate it i hate this phone. hard to find good cases and i hate the way it runs and the look i suggest universe atleast! don't buy,0.0
ORD268063,ID0844482495,2019-04-25,Thompson,"[('Lucent 330S', 2), ('Olivia x460', 1)]",3685.0,79.52,-37.8213625,144.94906569999995,5,3580.27,Autumn,True,0.9831,worth the price new phone for new carrier.,1.0
ORD455725,ID2624210238,2019-11-14,Thompson,"[('pearTV', 2), ('iStream', 2), ('Universe Note', 1)]",16370.0,107.68,-37.8021264,144.9540597,0,16477.68,Spring,True,1.3253,great phone i love this phone. only thing i wished everyone would have not taken away was the micosd expansion. that's crucial for pictures and videos to be kept separate from the phone as well as a good place for storing music.,1.0
ORD487996,ID4909776709,2019-03-23,Bakers,"[('Alcon 10', 1), ('Thunder line', 1), ('iAssist Line', 2)]",15580.0,81.78,-37.8230304,145.0001615,0,15661.78,Autumn,True,1.5143,"great value this is a good small no frills basic phone for making and getting calls, just what a phone is suppose to do",1.0
ORD186694,ID0777806540,2019-03-28,Thompson,"[('iStream', 1), ('Thunder line', 1)]",2330.0,67.4,-37.8031078,144.95557580000005,15,2047.9,Autumn,False,1.3014,great product. very good phone with price.. highly recommended .,1.0
ORD080806,ID1883787547,2019-05-22,Thompson,"[('Olivia x460', 2), ('Universe Note', 1), ('iAssist Line', 1)]",8125.0,81.73,-37.8255234,144.9482495,10,7394.23,Autumn,True,1.4342,"awesome phone! bought this phone for my wife. no problems, fast phone, great network coverage, fast wifi speeds, awesome video quality... overall best affordable phone.. and we have tmobile",1.0
ORD083691,ID0371967864,2019-01-05,Nickolson,"[('iStream', 1), ('iAssist Line', 2)]",4600.0,84.91,-37.807026799999996,144.9709796,25,3534.91,Summer,True,1.2939,"keeps freezing an every time it updates it freezes an ... keeps freezing an every time it updates it freezes an have shut it down,the charger that came with it don't even charge the phone, sorry to say but going back alcon,",0.0
ORD010126,ID0634784125,2019-01-26,Thompson,"[('pearTV', 1), ('Toshika 750', 1), ('Universe Note', 1)]",14080.0,72.8700000000008,-37.8138662,144.93714780000005,10,12744.87,Summer,False,0.8825,four stars good for the money windows is great,1.0
ORD424098,ID0581729739,2019-06-01,Thompson,"[('Lucent 330S', 1), ('Thunder line', 1)]",3410.0,74.09,-37.804736,144.9238514,25,2631.59,Winter,False,2.2249,i love it! excellent phone.,1.0
ORD206980,ID6167344561,2019-02-04,Nickolson,"[('Olivia x460', 1), ('iAssist Line', 2)]",5675.0,88.41,-37.8160506,144.97222109999996,5,5479.66,Summer,True,0.3679,four stars great,1.0
ORD184953,ID2441346319,2019-09-20,Bakers,"[('Lucent 330S', 1), ('Olivia x460', 1), ('Universe Note', 2)]",9355.0,104.18,-37.8047445,144.9837319,5,8991.43,Spring,True,1.1682,amazing !!! one of the best phone i have owned. i did switch from one plus 5t to toshika. i love the picture quality and the display.,1.0
ORD059610,ID2868682195,2019-08-16,Nickolson,"[('iStream', 1), ('iAssist Line', 2), ('Thunder line', 1), ('pearTV', 1)]",13090.0,68.36,-37.804631799999996,144.9704802,5,12503.86,Winter,False,1.5565,five stars excellent was new !!!,1.0
ORD067641,ID0130015093,2019-10-20,Nickolson,"[('Olivia x460', 2), ('Alcon 10', 1)]",11400.0,55.36,-37.8160369,144.9684751,25,8605.36,Spring,False,0.3001,"not verizon compatible phone looks brand new, but it is not compatible with verizon. description says it is, but data doesn't work.",0.0
ORD259950,ID3945799025,2019-03-23,Thompson,"[('Universe Note', 2), ('Olivia x460', 2), ('Thunder line', 2)]",13710.0,80.47,-37.819024799999994,144.95424619999997,0,13790.47,Autumn,True,0.9478,"i bought a refurbished one i bought a refurbished phone from the seller edge cellular, and it wasn't stolen or broken or anything like that. it works great. it looks new, the battery life is good, and i've had zero issues.",1.0
ORD195073,ID0243097403,2019-03-12,Nickolson,"[('Alcon 10', 2), ('Lucent 330S', 2), ('Olivia x460', 2)]",22810.0,62.13,-37.8195507,144.9636518,0,22872.13,Autumn,False,0.5295,this is a good product for your money. it's basic it does the job.,1.0
ORD263532,ID6237546496,2019-07-25,Bakers,"[('Candle Inferno', 1), ('Toshika 750', 2)]",9070.0,79.81,-37.8014698,145.00355430000005,25,6882.31,Winter,True,1.1986,great buy! love this phone. it's fast and the design is awesome. i'm very happy with the price i paid as well.,1.0
ORD309716,ID6167489483,2019-03-20,Nickolson,"[('Alcon 10', 1), ('Thunder line', 1), ('Universe Note', 1)]",14580.0,48.39,-37.8170761,144.9614947,5,13899.39,Autumn,False,0.7283,lack of app do not have migration app.,0.0
ORD204781,ID2288769504,2019-06-22,Bakers,"[('Lucent 330S', 2), ('Alcon 10', 2), ('Olivia x460', 1), ('Universe Note', 1)]",25035.0,65.71,-37.8017119,145.0043756,25,18841.96,Winter,True,1.2236,hate it i hate it so badly😠😡😠 it hot and it died too fast charge too quickly i want a new because my phone don't work no more,0.0
ORD370611,ID0655124686,2019-05-03,Thompson,"[('Thunder line', 2), ('Candle Inferno', 2)]",5220.0,63.07,-37.8081174,144.9424663,25,3978.07,Autumn,False,0.6489,good phone great phone. i love its features and is great,1.0
ORD321279,ID4326586224,2019-02-02,Nickolson,"[('iStream', 2), ('iAssist Line', 2), ('Universe Note', 1)]",8200.0,90.54,-37.8171905,144.9645271,10,7470.54,Summer,True,0.4686,great phone i like the phone. it will take some adjusting but so far so good.,1.0
ORD179156,ID1463547115,2019-05-30,Bakers,"[('iAssist Line', 2), ('iStream', 2), ('Lucent 330S', 2)]",7210.0,81.12,-37.818674,145.00522769999995,5,6930.62,Autumn,True,1.3061,"cheap is not necessarily a bad thing! i was able to jailbreak this and install whatsapp in the us. with an sd card, it's really all i need. best simplistic phone made to date. finally!",1.0
ORD060465,ID6167254951,2019-02-19,Nickolson,"[('Lucent 330S', 1), ('Toshika 750', 2), ('pearTV', 1), ('Universe Note', 1)]",19630.0,72.23,-37.8168138,144.9701116,25,14794.73,Summer,True,0.2043,"very disappointed. within days of receiving this item the screen intermittently got blurred. then within weeks the screen would go black for no apparent reason and i would have to force factory reset. now, i can even get the force factory reset to work. not worth the money! very disappointed.",0.0
ORD267841,ID0127638234,2019-04-23,Thompson,"[('Lucent 330S', 2), ('Thunder line', 2), ('Olivia x460', 2), ('iStream', 2)]",9570.0,62.60999999999967,-37.8084972,144.94553100000005,25,7240.11,Autumn,False,0.4841,nice device for the cost nicely designed.. great deal.. not the fastest but works well for its use,1.0
ORD182602,ID0255061143,2019-03-19,Nickolson,"[('pearTV', 1), ('Candle Inferno', 1), ('Lucent 330S', 1), ('Alcon 10', 1)]",16920.0,79.87,-37.8089652,144.9708184,15,14461.87,Autumn,True,1.0777,five stars very good cell phones everthing that i need and wanted .,1.0
ORD084895,ID2209383408,2019-05-03,Thompson,"[('Universe Note', 2), ('iAssist Line', 1), ('iStream', 1), ('Alcon 10', 1)]",18225.0,70.52,-37.7926299,144.95848490000003,5,17384.27,Autumn,False,2.4467,long battery life does take a clean picture in the night but other than that work profect,1.0
ORD410519,ID0775945828,2019-12-11,Thompson,"[('iStream', 1), ('Candle Inferno', 1), ('Olivia x460', 1)]",1805.0,63.99,-37.80643170000001,144.96079530000003,10,1688.49,Summer,False,1.3928,"fake advertisment, ""scam"" sorry, this video is unsupported on this browser.  do not buy this. i bought this for my mom , but instead i got an empty box with fake jewerly in it. the seller name is olivia ,but it is not. ""dont be foul""",0.0
ORD371059,ID0576843200,2019-09-22,Bakers,"[('Universe Note', 1), ('iStream', 2), ('Thunder line', 1)]",5930.0,108.30000000000018,-37.8247418,144.9899126,5,5741.8,Spring,True,1.7068,"this is as good as the reviews say and more very satified with the purchase; amazing value, power, speed and functionality.",1.0
ORD461553,ID3121558877,2019-11-06,Bakers,"[('Universe Note', 1), ('iStream', 2), ('Olivia x460', 1)]",4975.0,97.33,-37.8083323,145.00051230000003,0,5072.33,Spring,True,0.5,"cheap, clean android and fast cheap, clean android and fast i gave this as a gift to my mom who had an old microsoft phone before. she left her new olivia phone and chose this instead. this phone is much faster because of the clean android it has. battery lasts long enuf for her.",1.0
ORD332630,ID0781092760,2019-05-11,Thompson,"[('Toshika 750', 1), ('Alcon 10', 1)]",13270.0,65.18000000000029,-37.8023596,144.94301069999997,5,12671.68,Autumn,True,1.2023,this phone was far worse quality that the original j7 this phone was far worse quality that the original j7. i bought it thinking that it would have been a slightly faster upgrade and i am beyond disappointed.,0.0
ORD441534,ID3146808083,2019-07-04,Bakers,"[('iAssist Line', 1), ('Lucent 330S', 1)]",3455.0,48.3,-37.8122743,144.9890736,25,2639.55,Winter,False,0.598,not the best phone this sightly bends when play videos games on it it is made from cheap plastic i don't recommend this phone to cheap feeling and over price also the phone has the worst camera on slow time on apps low screen.,0.0
ORD005316,ID4283908188,2019-06-15,Bakers,"[('Lucent 330S', 1), ('Universe Note', 1), ('Alcon 10', 1), ('Olivia x460', 1)]",14855.0,55.02000000000044,-37.8120664,145.01463,15,12681.77,Winter,False,1.7214,one star was not please with boost services,0.0
ORD175654,ID0282854624,2019-06-12,Bakers,"[('Universe Note', 1), ('iStream', 2), ('iAssist Line', 1)]",5975.0,85.38,-37.803101399999996,145.0206127,25,4566.63,Winter,True,2.3605,good shape i'm very happy with the phone came in great condition everything works. not sure if it's just the phone itself but apps freeze and the system ui freezes,1.0
ORD192459,ID5563404262,2019-06-22,Bakers,"[('Candle Inferno', 2), ('iAssist Line', 1), ('Universe Note', 1)]",6535.0,69.04,-37.8176414,145.0107606,10,5950.54,Winter,False,1.6091,i have been waiting for the thunder show to go on sale and it was worth the wait. it was easy to set up and start using,1.0
ORD069460,ID2384091382,2019-08-23,Nickolson,"[('iStream', 1), ('Alcon 10', 1), ('Lucent 330S', 1), ('Thunder line', 2)]",14690.0,80.78,-37.8079398,144.9733751,25,11098.28,Winter,True,1.2329,the phone is great just left alcon notthing,1.0
ORD364062,ID6167489485,2019-04-24,Nickolson,"[('Alcon 10', 2), ('iAssist Line', 1), ('Thunder line', 1)]",22305.0,64.58,-37.8178333,144.9621506,10,20139.08,Autumn,False,0.6563,impressive wow. better than any lg or olivia i have owned and 1/3 the cost!!! i am so impressed. by far my favorite phone i have ever gad!!!! way to go toshika!!!,1.0
ORD026643,ID0054552164,2019-10-22,Nickolson,"[('Candle Inferno', 1), ('iAssist Line', 1), ('Alcon 10', 2)]",20555.0,105.79,-37.8210362,144.983106,0,20660.79,Spring,True,1.2225,nice it’s goodnfor what you pay,1.0
ORD035148,ID0282825811,2019-10-18,Thompson,"[('Candle Inferno', 2), ('Lucent 330S', 1), ('iStream', 2), ('pearTV', 1)]",8700.0,65.93,-37.80246010000001,144.9490368,5,8330.93,Spring,False,1.15,que es buen celular mas en usa es difícil su activación completa. buen celular pero no es compatible para la activación completa en usa..,0.0
ORD401865,ID0283334324,2019-06-10,Thompson,"[('Toshika 750', 1), ('Universe Note', 2), ('Candle Inferno', 1), ('Thunder line', 2)]",16010.0,65.93,-37.800736900000004,144.9517619,15,13674.43,Winter,False,1.3913,"glad i bought this phone was leery about buying a reconditioned phone, bought the phone over a month ago, no problems, no issues, works great this was replacing a note 5 that i had dropped. the phone was a better price than originally paid for the note 5.",1.0
ORD453333,ID0589533714,2019-10-25,Thompson,"[('pearTV', 1), ('iStream', 2)]",6610.0,89.1,-37.8216889,144.95512319999997,5,6368.6,Spring,True,1.2284,not factory unlocked i just bought it and its verizon wireless not unlocked,0.0
ORD101803,ID3213448167,2019-08-05,Thompson,"[('Olivia x460', 1), ('iStream', 1), ('Alcon 10', 2), ('Toshika 750', 1)]",23595.0,68.93,-37.80785570000001,144.9612233,15,20124.68,Winter,False,1.3554,excelent i like this product and the brand y very like. i used this many times and is very nice. i like it.,1.0
ORD368327,ID0319617898,2019-07-28,Bakers,"[('Toshika 750', 1), ('Olivia x460', 2)]",6770.0,74.13,-37.8110185,145.000558,15,5828.63,Winter,True,0.48200000000000004,emgo good product,1.0
ORD179989,ID4633638477,2019-06-27,Thompson,"[('Olivia x460', 1), ('Thunder line', 1)]",3405.0,61.86,-37.80642720000001,144.9445756,25,2615.61,Winter,False,0.7290000000000001,digico products all are original i buying for six years i never received bad items i like olivia universe note 9 it's easy and reliable to use all product i bought from digico are good items i told all my friends and family go buy items from digico,1.0
ORD448718,ID0387921006,2019-01-16,Nickolson,"[('Olivia x460', 2), ('Toshika 750', 1)]",6770.0,75.39,-37.82059520000001,144.9635094,15,5829.89,Summer,True,0.5760000000000001,"one star doesn't have good reception ... calls drop, easier to understand r2d2",0.0
ORD100542,ID6167440968,2019-01-20,Nickolson,"[('Olivia x460', 1), ('Lucent 330S', 2), ('Alcon 10', 2)]",21585.0,91.46,-37.815294,144.963572,5,20597.21,Summer,True,0.6415,item new as promised bought this to replace my stepfather's worn out rugby ii. he didn't want a smartphone. this is perfect for the older crowd who just don't want to mess with learning something new.,1.0
ORD235229,ID0443299469,2019-06-05,Bakers,"[('Olivia x460', 2), ('Thunder line', 2), ('iStream', 1)]",6960.0,64.59,-37.8110588,145.0010268,0,7024.59,Winter,False,0.5232,this is my second in this brand just loving it. size is good for ease to use.,1.0
ORD177926,ID0370241971,2019-04-02,Nickolson,"[('Thunder line', 2), ('Universe Note', 1), ('Lucent 330S', 1), ('Candle Inferno', 1)]",9470.0,69.87,-37.7991696,144.9712828,0,9539.87,Autumn,True,2.1677,did not receive a us phone i bought this phone because it was a us phone. unfortunately this is an international phone and is not usable. this is the first item i have had to return from digico. hope it goes smoothly because it was an expensive piece of worthless to me equipment.,0.0
ORD026604,ID0844496218,2019-10-12,Thompson,"[('Olivia x460', 1), ('pearTV', 2), ('Universe Note', 1), ('iStream', 1)]",17445.0,87.29,-37.82020670000001,144.9506248,15,14915.54,Spring,True,0.895,was not factory unlocked. locked to t-mobile. don’t waste your time with this seller. the phone is great but is not unlocked. waste of our time and money.,0.0
ORD031765,ID6167191723,2019-07-23,Nickolson,"[('Toshika 750', 2), ('pearTV', 1), ('iAssist Line', 1)]",17175.0,63.20999999999913,-37.8177067,144.959264,10,15520.71,Winter,True,0.91,"small battery size in my opinion. seriously a 3,060mah battery. very disappointing. i looked all over for the battery size for this phone. i had to go to a different page in order to search the size of the battery. i would prefer to have the phone bigger and heavier in order to have a bigger battery.",0.0
ORD464213,ID0576868762,2019-08-30,Bakers,"[('iStream', 2), ('Thunder line', 1)]",2480.0,70.32,-37.824382299999996,144.9903858,0,2550.32,Winter,False,1.6572,"great quality almost like new the device i received was beyond remark, impeccable.",1.0
ORD056434,ID1224869058,2019-11-11,Thompson,"[('Lucent 330S', 1), ('iStream', 1), ('Candle Inferno', 2), ('Thunder line', 1)]",4420.0,75.08,-37.8134657,144.9408574,5,4274.08,Spring,False,0.5533,"five stars this is the best smart phone, i'm very happy with it.",1.0
ORD495822,ID3215106485,2019-12-28,Thompson,"[('Toshika 750', 1), ('Universe Note', 1), ('pearTV', 1), ('iStream', 2)]",14380.0,55.99,-37.8086645,144.95073169999995,15,12278.99,Summer,False,0.5504,i will return it the phone began to have problems before i used it even for less than a month and i never dropped it either.,0.0
ORD005352,ID3810637324,2019-09-06,Thompson,"[('Alcon 10', 1), ('pearTV', 1), ('iAssist Line', 2), ('Thunder line', 1)]",21890.0,77.52,-37.821029700000004,144.943017,10,19778.52,Spring,False,0.9961,five stars great product. great dealer.,1.0
ORD458118,ID1449431554,2019-07-21,Nickolson,"[('iStream', 1), ('Candle Inferno', 1)]",580.0,63.99,-37.8134711,144.97373430000005,25,498.99,Winter,False,0.6787,"xperia xa1 so far, so good!",1.0
ORD237442,ID6221450545,2019-05-02,Bakers,"[('Toshika 750', 2), ('Candle Inferno', 2), ('Alcon 10', 1), ('Olivia x460', 2)]",20900.0,66.5,-37.808788899999996,144.9829109,10,18876.5,Autumn,True,1.0919,"don't buy a xp phone i'm on my 2 phone ... don't buy a xp phone i'm on my 2 phone the first one broke after 6 months i sent it to xp it took a month to get it back ( that say 7 to 10 days ) not it took 30 days .then 60 days later it went down agen! so i, going to buy a new phone not a xp!!",0.0
ORD155840,ID0777833057,2019-07-10,Thompson,"[('Toshika 750', 2), ('pearTV', 2), ('Olivia x460', 1)]",22485.0,81.82,-37.8040003,144.9585075,15,19194.07,Winter,True,1.3943,"five stars good team, works perfectly in venezuela with movilnet, very responsible seller, i would recommend.",1.0
ORD190163,ID0202774113,2019-08-01,Thompson,"[('iStream', 2), ('pearTV', 1)]",6610.0,81.89,-37.8059773,144.92798200000001,5,6361.39,Winter,True,1.8367,"genial me encanta mi telefono, la cámara es de excelente resolución, lo único malo es la huella digital en la parte frontal no siempre reconoce la huella y se femora, hay que acostumbrase a eso",1.0
ORD059043,ID0370750977,2019-09-09,Bakers,"[('Lucent 330S', 1), ('Universe Note', 2), ('Olivia x460', 2)]",10580.0,77.39,-37.8119739,144.986043,5,10128.39,Spring,False,0.8376,five stars this phone is cool and affordable! works really good..,1.0
