order_id,customer_id,date,nearest_warehouse,shopping_cart,order_price,delivery_charges,customer_lat,customer_long,coupon_discount,order_total,season,is_expedited_delivery,distance_to_nearest_warehouse,latest_customer_review,is_happy_customer
ORD088211,ID3085953483,2019-07-29,Bakers,"[('Toshika 750', 1), ('Universe Note', 2)]",11220.0,81.35000000000036,-37.823728100000004,144.98785149999995,10,10179.35,Winter,True,1.6607,"perfect, very happy very happy with the phone. perfect as described, no scratches",1.0
ORD045668,ID3518544265,2019-11-08,Bakers,"[('Thunder line', 1), ('Alcon 10', 1), ('Toshika 750', 1), ('Universe Note', 2)]",22350.0,87.77999999999884,-37.8033609,144.99055259999997,5,21320.28,Spring,True,0.8455,"runs out of storage all the time, making it ... runs out of storage all the time, making it very difficult to use. i would go with an alcon instead!",0.0
ORD221673,ID0560984940,2019-02-07,Thompson,"[('pearTV', 2), ('Thunder line', 1), ('Universe Note', 1), ('Candle Inferno', 2)]",19110.0,71.62,-37.8182245,144.94780459999996,0,19181.62,Summer,False,0.6213,the best phone ! i love it,1.0
ORD491242,ID2291074006,2019-12-19,Thompson,"[('Toshika 750', 1), ('iStream', 1), ('pearTV', 1)]",10780.0,87.36999999999989,-37.813093,144.9514986,25,8172.37,Summer,True,0.3924,four stars ok,1.0
ORD211888,ID2318307719,2019-07-30,Nickolson,"[('iAssist Line', 1), ('iStream', 1), ('Olivia x460', 2), ('Thunder line', 2)]",9185.0,78.78,-37.8107101,144.97585800000004,15,7886.03,Winter,True,1.0383,great phone :) great phone. great price. very happy to have and own this phone. :),1.0
ORD477261,ID0547568750,2019-09-03,Bakers,"[('iAssist Line', 1), ('Olivia x460', 1), ('Toshika 750', 1), ('Candle Inferno', 2)]",8630.0,83.38,-37.8104122,144.98826630000005,5,8281.88,Spring,True,0.6144,"that phone is junk. i bought this phone for my daughter, $164.99. she started using it april 21, 2016. also ordered screen protector and case. around june 8, 2016, the phone started to have malfunctions. now, the home screen button does not work. camera only works after turning phone off and on. return policy is 30 days. that phone is junk.",0.0
ORD168731,ID3213448178,2019-12-23,Thompson,"[('iAssist Line', 1), ('Thunder line', 1), ('Olivia x460', 2)]",6855.0,100.65,-37.80473370000001,144.96180090000001,0,6955.65,Summer,True,1.5684,great deal great customer service described as written. early delivery,1.0
ORD262385,ID2927793638,2019-07-26,Bakers,"[('Candle Inferno', 1), ('Toshika 750', 1), ('iAssist Line', 2), ('Alcon 10', 1)]",18150.0,80.56,-37.822345899999995,144.99850700000005,0,18230.56,Winter,True,1.4046,five stars excellent product and seller,1.0
ORD141125,ID0714724455,2019-03-05,Nickolson,"[('Olivia x460', 2), ('Toshika 750', 1)]",6770.0,77.21,-37.818252799999996,144.9751372,0,6847.21,Autumn,True,0.4927,best phone ever love everything about it,1.0
ORD222263,ID3293343016,2019-08-24,Nickolson,"[('Lucent 330S', 1), ('Olivia x460', 2), ('pearTV', 2)]",16300.0,77.28,-37.823842299999995,144.98149750000005,10,14747.28,Winter,True,1.202,good phone battery life wasn't all that great but the rest of the phone seems fine,1.0
ORD225437,ID0367849053,2019-07-17,Nickolson,"[('Thunder line', 1), ('Universe Note', 1), ('Candle Inferno', 1)]",6060.0,70.19,-37.802534,144.9645872,15,5221.19,Winter,False,1.8404,"great phone great phone for good price, new in original att packaging, fast shipping",1.0
ORD430538,ID0207085442,2019-12-04,Bakers,"[('Alcon 10', 2), ('Universe Note', 1), ('iAssist Line', 1)]",23575.0,82.32,-37.81071420000001,145.01545969999995,10,21299.82,Summer,False,1.7807,worth the l very good choice and price,1.0
ORD476684,ID0767752603,2019-02-20,Nickolson,"[('Olivia x460', 1), ('Candle Inferno', 2), ('Toshika 750', 1)]",6405.0,67.34,-37.8021231,144.96985990000005,25,4871.09,Summer,False,1.8338,"two stars this device has problems charging, sofware and i can't return it. don't buy",0.0
ORD035836,ID2302316260,2019-09-21,Nickolson,"[('Candle Inferno', 2), ('iStream', 2), ('Alcon 10', 1), ('Universe Note', 2)]",17010.0,103.91,-37.81135379999999,144.9785104,5,16263.41,Spring,True,1.1272,it's a luck of the draw the phone works that's all i can ask for.,1.0
ORD363980,ID1479905307,2019-04-05,Thompson,"[('Thunder line', 1), ('Olivia x460', 1)]",3405.0,66.01000000000022,-37.8212164,144.9558445,0,3470.01,Autumn,True,1.2247,"not fully refurbished!!! another refurbish fail. the battery won't hold a charge, and this phone was not restored to factory settings. battery should be replaced with new as part of a refurb. very disappointed. will never purchase another ""certified refurbished"" item through digico. ends up being more hassle for not much savings.",0.0
ORD092330,ID0778942036,2019-06-20,Bakers,"[('Thunder line', 1), ('pearTV', 2), ('Olivia x460', 1)]",16025.0,71.81,-37.8168985,145.0141518,5,15295.56,Winter,False,1.8327,great phone at a great price! sleek design with all the features i need at a reasonable price point. extremely satisfied!,1.0
ORD167016,ID0746924542,2019-12-08,Nickolson,"[('Thunder line', 1), ('Candle Inferno', 1), ('Toshika 750', 2)]",11250.0,62.42000000000007,-37.8239391,144.98250119999997,10,10187.42,Summer,False,1.2848,horrible this was a refurbished phone and the battery would not stay charged and calls would be dropped,0.0
ORD119433,ID5002595132,2019-10-24,Thompson,"[('Alcon 10', 2), ('Universe Note', 2)]",24800.0,84.27,-37.811867299999996,144.9529678,25,18684.27,Spring,True,0.5265,two stars can't wait to get my phone.,0.0
ORD398166,ID3208518267,2019-04-15,Nickolson,"[('Thunder line', 2), ('Olivia x460', 1), ('Candle Inferno', 1)]",6015.0,56.94999999999982,-37.7997609,144.9726302,0,6070.95,Autumn,False,2.114,"doesn't work the phone stopped working after a couple of days. we are trying to have it fixed or replaced, otherwise we will simply return it and buy another one.",0.0
ORD430135,ID1728560650,2019-12-13,Thompson,"[('Lucent 330S', 2), ('Candle Inferno', 1), ('Universe Note', 2)]",9790.0,98.49,-37.82139960000001,144.9357672,25,7440.99,Summer,True,1.3897,thank you ! absolutely love it. it came unlocked. and it world’s wonderfully. i would take a picture but i’m using it to write this review.inwas skeptical but i’m glad i took the chance . thanks !,1.0
ORD067863,ID0781092760,2019-12-14,Thompson,"[('Olivia x460', 2), ('Candle Inferno', 2), ('iStream', 1), ('Universe Note', 1)]",6910.0,78.67,-37.8023596,144.94301069999997,25,5261.17,Summer,False,1.2023,five stars good phone as described fast shipping good camera,1.0
ORD279242,ID6167344597,2019-01-18,Nickolson,"[('Olivia x460', 2), ('Toshika 750', 1), ('iStream', 2), ('pearTV', 1)]",13380.0,73.3700000000008,-37.8120192,144.97069580000004,10,12115.37,Summer,False,0.7389,ignore the pixel 3 xl hate! great phone for android fans! i just love the simplistic design and the notch on the top! just make sure to get a proper screen protector and phone case as it's a fingerprint and scratch magnet.,1.0
ORD331728,ID0844469992,2019-12-17,Thompson,"[('Olivia x460', 2), ('Thunder line', 1)]",4630.0,95.76,-37.8224711,144.9474014,5,4494.26,Summer,True,1.0911,"great value for the money! i bought this as a replacement for my home landline and old (> 10 years old) set of wireless (non-cellular) phones. for the money, this olivia a10 phone has much more features than what i paid for on the old set of phones. fantastic value!",1.0
ORD336692,ID0131238813,2019-09-08,Nickolson,"[('Olivia x460', 2), ('pearTV', 2), ('Thunder line', 2)]",19430.0,101.55,-37.8135033,144.96178989999999,5,18560.05,Spring,True,0.8872,clear music,1.0
ORD329458,ID1288940402,2019-03-02,Thompson,"[('pearTV', 1), ('Toshika 750', 2), ('Universe Note', 2)]",21850.0,65.6,-37.818868,144.9522176,25,16453.1,Autumn,False,0.8249,good stuff just a great phone very nice,1.0
ORD143816,ID4520380455,2019-02-25,Nickolson,"[('Alcon 10', 2), ('Thunder line', 2)]",22260.0,95.57,-37.82123720000001,144.961431,15,19016.57,Summer,True,0.7722,i bought this for my mother and she loves it! i want to get one for myself now!,1.0
ORD255290,ID5884356142,2019-01-26,Thompson,"[('Lucent 330S', 1), ('Olivia x460', 2)]",3680.0,100.59,-37.8245745,144.9357416,5,3596.59,Summer,True,1.6575,great little phone this is my husband’s 2nd phone like this. he is so hard on his phones! he’s always working outside and drops them frequently. this phone is tough and made to military standards. also it is just a plain flip phone so he can actually work it lol,1.0
ORD116808,ID5402876537,2019-03-16,Nickolson,"[('Toshika 750', 1), ('Thunder line', 1)]",6500.0,65.29,-37.8210658,144.9770455,0,6565.29,Autumn,False,0.7141,it's good it's good,1.0
ORD244535,ID0356098927,2019-12-30,Bakers,"[('Universe Note', 2), ('Alcon 10', 2), ('Lucent 330S', 1), ('Candle Inferno', 2)]",26890.0,98.54,-37.821439700000006,144.99282319999998,15,22955.04,Summer,True,1.2914,this is an intermediate size tablet that works very well for its designed purpose. the price was good and it has plenty of acc.,1.0
ORD056011,ID0250933636,2019-12-16,Bakers,"[('iAssist Line', 1), ('Universe Note', 2)]",9125.0,102.73,-37.823513,145.0075823,15,7858.98,Summer,True,1.8557,most satisfied with product received on schedule (standard ship was only option) and couldn't tell it a refurb. came with everything but earbuds. most satisfied with product.,1.0
ORD225590,ID5402876196,2019-10-05,Nickolson,"[('Lucent 330S', 2), ('Thunder line', 2), ('Candle Inferno', 1), ('iStream', 1)]",7400.0,60.49,-37.820932299999996,144.97666930000003,10,6720.49,Spring,False,0.6779,didn't work. sent it back. this phone was a refurb and didn't work. i had to send it back and was only partially reimbursed for shipping. i advise against purchasing this.,0.0
ORD491527,ID0589501046,2019-05-05,Nickolson,"[('pearTV', 1), ('Candle Inferno', 1), ('Thunder line', 2)]",11100.0,79.89999999999964,-37.820496399999996,144.9572389,10,10069.9,Autumn,True,1.1032,excelent good product thanks is excelent universe s4 is an incredible phone. i have been using this unlocked s4 for past 2 days helping a friend to migrate from alcon 4s. my friend has been on alcon and it also gave me a unique perspective. i used alcon for couple of years and been using android,1.0
ORD458180,ID6197211594,2019-08-13,Thompson,"[('Toshika 750', 2), ('iAssist Line', 2), ('Alcon 10', 1)]",22040.0,67.22,-37.8156966,144.93271919999995,10,19903.22,Winter,False,1.306,mother-in-law pleased! i bought it for my mother-in-law when her other xperia finally died. she loves it.,1.0
ORD429288,ID0250774471,2019-11-01,Bakers,"[('Olivia x460', 1), ('Lucent 330S', 1)]",2455.0,106.54,-37.817347399999996,145.008734,10,2316.04,Spring,True,1.4421,"awesome phone with quality. this phone is awesome. it's response very fast, both bluetooth and wifi work same time. it's a very good phone.",1.0
ORD446107,ID3967630114,2019-02-17,Thompson,"[('Thunder line', 1), ('Alcon 10', 2)]",20080.0,77.59,-37.819088,144.9517341,10,18149.59,Summer,True,0.8235,"bad camera no very happy at moment, the phone camera has started to go bad, and tgere is no way to contact seller",0.0
ORD497913,ID0664322638,2019-08-21,Thompson,"[('Toshika 750', 2), ('Alcon 10', 1), ('Olivia x460', 1), ('pearTV', 1)]",25125.0,76.29,-37.815740999999996,144.95406119999996,0,25201.29,Winter,True,0.7034,"universe s6 wonderful (2016) works great the year i bought it , now it's slow and won't stay on for long period of times .. but universe has never let me down ..thanks guys awesome company",1.0
ORD339781,ID5402876530,2019-04-27,Nickolson,"[('iAssist Line', 2), ('pearTV', 1)]",10760.0,79.51,-37.8210245,144.9767611,10,9763.51,Autumn,True,0.6893,bought this for my daughter to replace a worn out ipad. she is happier with the size. the resolution is nice. great buy for the price,1.0
ORD421900,ID0257506564,2019-10-03,Thompson,"[('Lucent 330S', 2), ('Toshika 750', 1), ('Alcon 10', 1)]",15730.0,85.73,-37.7995634,144.9632243,10,14242.73,Spring,False,2.0368,don’t be afraid to buy it worth it like new don’t be afraid to buy,1.0
ORD144025,ID0746912864,2019-05-20,Nickolson,"[('Toshika 750', 1), ('Candle Inferno', 1)]",4750.0,68.03,-37.82489,144.98486640000004,0,4818.03,Autumn,False,1.5181,"we originally got the show to video chat family members, and it works great for that. we have found that we really like checking things hands-free like the weather and recipes. so far we have really liked the show, and would recommend it!",1.0
ORD411017,ID0294622375,2019-07-29,Nickolson,"[('Toshika 750', 2), ('pearTV', 1), ('iStream', 1), ('Universe Note', 1)]",18550.0,73.73,-37.8182545,144.96696709999995,15,15841.23,Winter,True,0.2304,easy to use i love it.,1.0
ORD399466,ID0338577817,2019-06-09,Bakers,"[('Lucent 330S', 1), ('iStream', 1), ('Thunder line', 2)]",5740.0,69.35,-37.8034129,144.97992340000005,25,4374.35,Winter,False,1.5329,five stars very good quality. easy set up and fast delivery.,1.0
ORD014244,ID0589708344,2019-09-24,Thompson,"[('Toshika 750', 2), ('iAssist Line', 1), ('Thunder line', 2)]",15225.0,103.79,-37.8208189,144.9550615,0,15328.79,Spring,True,1.1473,four stars very good meet the expectations.,1.0
ORD418819,ID0746912633,2019-02-18,Nickolson,"[('Universe Note', 1), ('iStream', 1), ('Thunder line', 1), ('iAssist Line', 1)]",8005.0,81.2,-37.825721200000004,144.9845267,10,7285.7,Summer,False,1.5373,drone display nice phone and graphics for my mavic pro drone,1.0
ORD443612,ID2140731827,2019-11-14,Thompson,"[('Toshika 750', 1), ('pearTV', 2), ('Lucent 330S', 2)]",19400.0,117.70000000000073,-37.798871399999996,144.9198335,5,18547.7,Spring,True,2.8457,"no straight talk love the phone, is what i wanted, a simple durable flip phone to talk on when i am out in the field. will not work on straight talk or anyone other than verizon!!!!",1.0
ORD365025,ID0317535760,2019-07-03,Nickolson,"[('Universe Note', 1), ('Candle Inferno', 2), ('Lucent 330S', 2), ('pearTV', 2)]",19390.0,52.8,-37.8060103,144.96495330000005,5,18473.3,Winter,False,1.4581,dont buy from them!!!!!! great phone but the ones they sell start to have problems after only four months. get it from microsoft if you want it to work,0.0
ORD235178,ID0579383913,2019-05-04,Thompson,"[('pearTV', 1), ('Alcon 10', 1)]",15260.0,68.06,-37.8243707,144.94256299999995,0,15328.06,Autumn,False,1.3611,great great,1.0
ORD476978,ID3212024914,2019-05-08,Thompson,"[('Toshika 750', 1), ('Universe Note', 2), ('pearTV', 1)]",17530.0,62.71,-37.808468100000006,144.94784199999995,5,16716.21,Autumn,True,0.473,one star battery life is bad and it just doesn't function like it should,0.0
ORD380703,ID0441587731,2019-12-30,Thompson,"[('Candle Inferno', 2), ('Olivia x460', 1)]",2084.0,91.89,-37.8143214,144.9380749,0,2175.89,Summer,True,0.8119,good phone my sister love't,1.0
ORD364300,ID6221450541,2019-07-22,Bakers,"[('Thunder line', 1), ('Olivia x460', 2)]",4630.0,62.64,-37.8088186,144.98325419999995,10,4229.64,Winter,True,1.0615,"i hated it because i was told that the water proof ... two weeks after i bought it, it got problem. :( it got wet and failing the microphone, i hated it because i was told that the water proof was really good. take care with olivia.",0.0
ORD434104,ID6273358849,2019-08-21,Thompson,"[('Candle Inferno', 2), ('iAssist Line', 1), ('Universe Note', 2)]",9985.0,83.93,-37.799564000000004,144.96246580000005,15,8571.18,Winter,True,1.9908,i love it.  it is so easy to use,1.0
ORD043912,ID5884356135,2019-01-13,Thompson,"[('pearTV', 1), ('Candle Inferno', 1), ('Alcon 10', 2), ('Olivia x460', 2)]",27090.0,101.38,-37.8239546,144.9374274,25,20418.88,Summer,True,1.5152,the olivia a50 is a great phone. the a50 is an excellent phone at a great price. i very much pleased with the speed and the operation of the android software. very quick and long lasting charge. purchased it unlocked so i can easily move to any phone plan.,1.0
ORD152682,ID0259616699,2019-02-27,Thompson,"[('Olivia x460', 1), ('Candle Inferno', 2), ('iStream', 2)]",2385.0,80.28,-37.8173369,144.9562328,10,2226.78,Summer,True,0.9586,"doesnt work on any network horrible, have tried on 5 different networks, wont work.",0.0
ORD459437,ID0122741213,2019-03-11,Nickolson,"[('Alcon 10', 2), ('iAssist Line', 2), ('Toshika 750', 2)]",30990.0,81.36,-37.8242093,144.9569549,15,26422.86,Autumn,True,1.2718,great phone love the screen size.,1.0
ORD256710,ID1224821963,2019-04-27,Thompson,"[('Thunder line', 1), ('Olivia x460', 2), ('iAssist Line', 1)]",6855.0,77.54,-37.8124034,144.9382877,5,6589.79,Autumn,True,0.7728,"five stars best phone ever, works in trinidad just toss in both ur micro sims.",1.0
ORD089129,ID4315294435,2019-06-24,Thompson,"[('Candle Inferno', 1), ('iAssist Line', 1)]",2655.0,64.24,-37.8170536,144.95332209999995,25,2055.49,Winter,False,0.735,good. but could be better sometime it's so difficult to recognize your fingerprint... you will get 4 times and just wont happen... over and over again.,1.0
ORD363481,ID0612741123,2019-01-24,Nickolson,"[('Olivia x460', 2), ('Candle Inferno', 1)]",2880.0,95.99,-37.81521770000001,144.9619514,10,2687.99,Summer,True,0.7668,"good product it's what i expect,good product",1.0
ORD328634,ID3085953493,2019-11-08,Nickolson,"[('Thunder line', 1), ('Olivia x460', 1)]",3405.0,60.59,-37.817749600000006,144.97469719999995,25,2614.34,Spring,False,0.4622,system update the system update sucks. runied my phone. very upset. paid alot of money for this phone,0.0
ORD219214,ID3146808086,2019-12-28,Bakers,"[('Olivia x460', 2), ('Candle Inferno', 2), ('Universe Note', 1), ('pearTV', 1)]",13070.0,90.18,-37.8127105,144.9902935,15,11199.68,Summer,True,0.5291,new xp 6 phone although the phone was delivered a day late and the package was open the phone is ok. every thing that was advertised.,1.0
ORD473754,ID0576868847,2019-02-17,Bakers,"[('Toshika 750', 2), ('iAssist Line', 1)]",10865.0,82.24,-37.824579299999996,144.9903335,5,10403.99,Summer,False,1.6795,good phone great phone overall especially for the price fingerprint sensor is not the best so as face recognition but battery last a whole day,1.0
ORD198735,ID0250933639,2019-03-31,Bakers,"[('Thunder line', 1), ('Universe Note', 1), ('iStream', 1)]",5780.0,84.07,-37.8247764,145.00658230000005,10,5286.07,Autumn,True,1.9244,not a stupid phone! all i need.. not a stupid phone! lol,1.0
ORD216999,ID6206786039,2019-02-05,Nickolson,"[('iAssist Line', 1), ('Candle Inferno', 1)]",2655.0,72.74,-37.8114994,144.970394,10,2462.24,Summer,False,0.7933,good condition just had to get a new battery the phone was in good condition just had to get a new battery,1.0
ORD489909,ID0634783569,2019-06-01,Thompson,"[('Thunder line', 1), ('Candle Inferno', 1), ('Lucent 330S', 2)]",5070.0,77.47,-37.8127454,144.93719109999995,0,5147.47,Winter,True,0.8687,tl:dr - get it this is an awesome product. i have dropped it 100 times yet it still works. everything i need in a phone for a college student. perfect. so many cool features,1.0
ORD112501,ID0373649831,2019-12-20,Thompson,"[('pearTV', 2), ('Alcon 10', 1)]",21570.0,66.23999999999978,-37.8092101,144.9291215,25,16243.74,Summer,False,1.6248,doa before i even turned it on i tried to put it in a case and saw that the screen had popped out of the casing. the phone wouldn't turn on so i tried to charge it. the cable was loose in the charging port and the phone never powered on!!,0.0
ORD398233,ID0250480662,2019-07-20,Bakers,"[('Lucent 330S', 1), ('Olivia x460', 2), ('Alcon 10', 2), ('Universe Note', 1)]",25030.0,58.96,-37.8092109,145.00089419999995,25,18831.46,Winter,True,0.5056,one star useless - drops calls when switching between cell towers. total waste of money.,0.0
ORD056143,ID0312718315,2019-11-16,Thompson,"[('Universe Note', 1), ('iStream', 1), ('Candle Inferno', 2)]",4460.0,82.13,-37.8030898,144.9612977,25,3427.13,Spring,False,1.6444,five stars clean phone works great,1.0
ORD114935,ID1459448712,2019-12-15,Bakers,"[('Lucent 330S', 1), ('Olivia x460', 1), ('iStream', 2), ('Universe Note', 2)]",9655.0,80.43,-37.8195581,145.0080938,15,8287.18,Summer,False,1.5532,five stars loving it!,1.0
ORD393815,ID4260094037,2019-07-21,Nickolson,"[('pearTV', 1), ('iStream', 2)]",6610.0,80.21,-37.822615,144.9581003,15,5698.71,Winter,True,1.1019,best product impossible full fast shipping and high quality product ... best product impossible full fast shipping and high quality product recommend and i just have more to buy new it¨s great !!!,1.0
ORD038167,ID2776664747,2019-11-22,Nickolson,"[('Toshika 750', 1), ('Universe Note', 1), ('Candle Inferno', 1), ('Thunder line', 1)]",10380.0,65.17000000000007,-37.8244828,144.95532,15,8888.17,Spring,False,1.4126,i'm used to a n ipad so i wasnt impressed with the candle. i found it hard to navigate,0.0
ORD476115,ID6167417981,2019-04-06,Nickolson,"[('Candle Inferno', 2), ('iStream', 2)]",1160.0,79.31,-37.8116665,144.97159399999995,25,949.31,Autumn,True,0.7919,"thanks i really love the phone camera is awesome, the only concern i have is face lock it doesn't give me an option but the rest is excellent",1.0
ORD213794,ID0370749206,2019-01-04,Bakers,"[('Lucent 330S', 2), ('iStream', 1)]",2610.0,63.2,-37.814989399999995,144.98287290000005,10,2412.2,Summer,False,1.2208,received messed up phone not happy...phone not even a month old and having issues with screen...i have no other phone to switch to or the money to buy one so cant send this one back.,0.0
ORD289551,ID2302923326,2019-06-07,Nickolson,"[('Lucent 330S', 2), ('Candle Inferno', 1)]",2890.0,63.35,-37.8158579,144.98237680000003,10,2664.35,Winter,True,1.1683,terrible phone this phone stops functioning properly after only 5 months of use and there is no recourse. do not buy from this seller.,0.0
ORD093280,ID6167344511,2019-03-09,Nickolson,"[('iAssist Line', 2), ('pearTV', 1)]",10760.0,67.40999999999985,-37.8068471,144.96579430000003,25,8137.41,Autumn,False,1.3488,great phone lucentrola makes some great phones and the g6 is one of the best. it is probably the best phone for the money available at digico.,1.0
ORD017112,ID1463656479,2019-03-28,Bakers,"[('Alcon 10', 1), ('Lucent 330S', 1), ('Toshika 750', 2), ('Thunder line', 2)]",23180.0,65.53,-37.8185602,144.9991906,5,22086.53,Autumn,False,1.0149,four stars perfect,1.0
ORD491072,ID3146808097,2019-04-30,Bakers,"[('Toshika 750', 1), ('Candle Inferno', 1)]",4750.0,78.57999999999993,-37.8105239,144.98531409999995,25,3641.08,Autumn,True,0.8742,"restricted use outside of us buttons tough to locate; restricted functionality outside of us; can't use access point. no fm. good call clarity. a tad heavy, but not bad.",1.0
ORD402940,ID1879266191,2019-09-08,Thompson,"[('iAssist Line', 2), ('Lucent 330S', 1)]",5680.0,94.58,-37.8030396,144.96318780000001,0,5774.58,Spring,True,1.7776,disappointed in the process of returning this for a refund because the device i received has significant screen burn.,0.0
ORD102360,ID0746340925,2019-07-31,Bakers,"[('iStream', 1), ('Olivia x460', 2), ('Alcon 10', 2), ('Candle Inferno', 1)]",20930.0,58.35,-37.80824860000001,144.99485,10,18895.35,Winter,True,0.1974,"no good bad storage capacity, does not allow external storage, so it is very bad investment.",0.0
ORD122818,ID4326586192,2019-03-12,Nickolson,"[('Universe Note', 2), ('pearTV', 2), ('Alcon 10', 1)]",28470.0,66.47,-37.8103246,144.961283,5,27112.97,Autumn,True,1.1731,"dont’ buy it. phone worked for a little over a month, just past the return deadline. it is a pos. let the buyer beware.",0.0
ORD496219,ID3213448170,2019-10-01,Thompson,"[('Universe Note', 1), ('Olivia x460', 2), ('Alcon 10', 1)]",14850.0,66.34,-37.8079464,144.96088989999996,10,13431.34,Spring,False,1.3245,wifi issues this model has big wifi issues. the wifi signal suddenly drops down. the internet speed is so slow that you cant navigate in any website. look in google and you will know that this issue is a very common one.,0.0
ORD029887,ID0282825791,2019-06-25,Thompson,"[('Thunder line', 2), ('Lucent 330S', 1), ('Candle Inferno', 2), ('Toshika 750', 2)]",15090.0,52.45,-37.8019411,144.94870680000002,0,15142.45,Winter,False,1.2033,"se congela la pantalla tengo problemas con este teléfono, ya que desde el inicio de su compra se le congela la pantalla, no lo recomiendo es muy malo",0.0
ORD286044,ID4294474623,2019-12-11,Nickolson,"[('Toshika 750', 1), ('Lucent 330S', 1)]",5550.0,80.02,-37.805364399999995,144.9737134,15,4797.52,Summer,False,1.5176,"great phone for the price screen, features, great battery life, beat budget phone",1.0
ORD362306,ID0277117986,2019-05-04,Thompson,"[('iAssist Line', 1), ('pearTV', 2)]",14845.0,80.52,-37.8238015,144.94760259999995,0,14925.52,Autumn,True,1.2397,"couldn’t be happier with my phone love, love, love. like new.",1.0
ORD326804,ID1463620781,2019-05-16,Bakers,"[('Toshika 750', 1), ('Olivia x460', 2), ('Universe Note', 1), ('pearTV', 1)]",16530.0,80.21,-37.814451700000006,145.0076823,5,15783.71,Autumn,True,1.202,awesome phone dropped my huawei mate 20 lite phone into water and bought it again,1.0
ORD035019,ID0611984646,2019-03-02,Nickolson,"[('Thunder line', 2), ('Olivia x460', 1)]",5585.0,63.41,-37.8154488,144.96276730000002,10,5089.91,Autumn,False,0.6918,"overall good value my husband loves this phone and has had it for a year now! great specs, great battery life is great and he's has no problems with it.",1.0
ORD410708,ID0332794352,2019-12-26,Bakers,"[('iStream', 1), ('pearTV', 1), ('Candle Inferno', 1)]",6890.0,92.92,-37.809502200000004,145.00433600000005,5,6638.42,Summer,True,0.8025,good phone great phone,1.0
ORD380021,ID3106293372,2019-05-21,Thompson,"[('pearTV', 2), ('Alcon 10', 2), ('iStream', 2)]",30820.0,66.72,-37.80658320000001,144.9324858,15,26263.72,Autumn,True,1.4507,cracked phone on arrival and only a half refund. don't buy had a great picture. was a slim parading that fit my hand great! however arrived with a crack through the screen... returned and they are trying to say 240 dollar phone returned only gets 120....,0.0
