order_id,customer_id,date,nearest_warehouse,shopping_cart,order_price,delivery_charges,customer_lat,customer_long,coupon_discount,order_total,season,is_expedited_delivery,distance_to_nearest_warehouse,latest_customer_review,is_happy_customer
ORD000328,ID0089542475,2019-10-01,Thompson,"[('Thunder line', 1), ('Candle Inferno', 1)]",2610.0,67.02,-37.802386799999994,144.956477,15,2285.52,Spring,False,1.4127,bought this tablet for my daughter. it was very hard to figure out how to switch to the kids profile. she used it for maybe a day and when we went to charge it the cable just fell out and wouldn't actually charge.,0.0
ORD372147,ID0310949030,2019-11-26,Bakers,"[('Universe Note', 2), ('iStream', 1), ('pearTV', 1)]",13360.0,76.47,-37.8046549,145.0019024,15,11432.47,Spring,False,0.8353,"worth the money , updates and functions perfect still working perfectly",1.0
ORD418006,ID4516260661,2019-09-08,Thompson,"[('iAssist Line', 2), ('iStream', 1)]",4600.0,84.42,-37.8083424,144.94738059999997,0,4684.42,Spring,True,0.4829,"un desastre me duro un mes, al mes se apagó y es necesario llevarlo al servicio técnico. lo compre en eeuu y ahora estoy en argentina y la garantía de lucentrola no es intenacional, sólo cubre el pais de compra",0.0
ORD470845,ID0579487458,2019-01-18,Thompson,"[('pearTV', 2), ('Alcon 10', 2)]",30520.0,75.18999999999869,-37.8163473,144.9509305,5,29069.19,Summer,True,0.5316,terrible it started off well enough. the phone will not hold a charge. it started just after the digico return agreement ended. the company was not help. i am now stuck with junk,0.0
ORD145447,ID0777806543,2019-04-22,Thompson,"[('Olivia x460', 2), ('Candle Inferno', 1), ('Toshika 750', 1)]",7200.0,65.27,-37.803154299999996,144.9555269,10,6545.27,Autumn,True,1.2947,this product is not as described!!! this phone runs hot when doing simple little tasks! i am not happy at all!!!,0.0
ORD325989,ID0714724455,2019-12-14,Nickolson,"[('Universe Note', 2), ('Candle Inferno', 1), ('iAssist Line', 2), ('Toshika 750', 2)]",20420.0,71.09,-37.818252799999996,144.9751372,25,15386.09,Summer,False,0.4927,friendly not too complicated good phone in general,1.0
ORD288872,ID2272188022,2019-06-23,Bakers,"[('Toshika 750', 1), ('pearTV', 1), ('Candle Inferno', 2)]",11490.0,77.81,-37.8037783,145.00523959999995,25,8695.31,Winter,True,1.1197,"installed on my back porch, works very well!  i did have to get the wall mount for it, which also works well.",1.0
ORD360062,ID3222703073,2019-11-17,Thompson,"[('Thunder line', 2), ('Universe Note', 2), ('iStream', 2), ('Alcon 10', 1)]",20510.0,79.55,-37.8019894,144.943021,5,19564.05,Spring,False,1.2414,works well what i wanted at a good price,1.0
ORD122419,ID0282854573,2019-08-18,Bakers,"[('Lucent 330S', 1), ('pearTV', 1)]",7540.0,84.97,-37.80023900000001,145.01521609999998,0,7624.97,Winter,True,2.0661,"phone is okay.. could be nice phone is even though is refurbished, it's wasn't even charge at all. there was some scratches that why i took some phone some minor star",1.0
ORD274246,ID0501019005,2019-02-17,Nickolson,"[('Toshika 750', 1), ('iAssist Line', 2), ('Universe Note', 1), ('Lucent 330S', 2)]",14680.0,80.34,-37.8049221,144.9731125,15,12558.34,Summer,False,1.5539,language the language upon opening was spanish but it was very easy to change to english.,1.0
ORD376413,ID1883302855,2019-09-12,Thompson,"[('Olivia x460', 2), ('Lucent 330S', 1), ('Alcon 10', 2), ('Universe Note', 2)]",28480.0,79.08000000000175,-37.8031422,144.9423665,25,21439.08,Spring,False,1.1387,phone life best phone ever,1.0
ORD329569,ID2670903131,2019-01-19,Thompson,"[('Alcon 10', 2), ('Olivia x460', 2), ('iAssist Line', 1), ('Toshika 750', 2)]",31215.0,67.84,-37.8034526,144.96288169999997,5,29722.09,Summer,False,1.7285,disappointed the microphone didn't work. i'm paying for repairs already. too inconvenient to return it. amason is 0 for 2 with electronics for me.,0.0
ORD283134,ID3967630060,2019-06-07,Thompson,"[('iStream', 1), ('Candle Inferno', 2)]",1010.0,61.02,-37.817242799999995,144.95164259999999,10,970.02,Winter,True,0.6485,"got the phone and the battery was instantly terrible. would not hold a charge for very long got the phone and the battery was instantly terrible. would not hold a charge for very long, even if i was not using my phone or had apps running. now it won't charge at all so i can't use the phone.",0.0
ORD427385,ID4976357659,2019-04-04,Nickolson,"[('Universe Note', 1), ('iStream', 1), ('Olivia x460', 2), ('Candle Inferno', 1)]",6480.0,77.85,-37.814040399999996,144.9676254,5,6233.85,Autumn,True,0.5345,"great budget phone!! watch review on youtube @ c butler, amazing value and excellent cameras!!",1.0
ORD058150,ID2948774567,2019-05-01,Nickolson,"[('Universe Note', 2), ('Thunder line', 2), ('pearTV', 2), ('Olivia x460', 1)]",25105.0,52.15,-37.8083448,144.9715553,5,23901.9,Autumn,False,1.1546,this phone is garbage the touch screen isn't working false advertisement sent back ... this phone is garbage the touch screen isn't working false advertisement sent back the phone the next day can't use it at all.... i wouldn't recommend this company to anyone ever!!,0.0
ORD213426,ID0294624011,2019-12-11,Nickolson,"[('Toshika 750', 1), ('Alcon 10', 2), ('Lucent 330S', 2), ('iStream', 2)]",24980.0,69.53,-37.8194833,144.9628206,10,22551.53,Summer,False,0.6,outstanding phone totally great phone. look and especially feel are many times greater than in photos. regarding camera - even loyal alcon users sadly confirm it's full awesomeness.,1.0
ORD397435,ID4716795572,2019-04-28,Thompson,"[('Universe Note', 2), ('Toshika 750', 2), ('pearTV', 2), ('Olivia x460', 1)]",29385.0,80.13,-37.8190521,144.9525961,5,27995.88,Autumn,True,0.8605,i use this as my backup phone. it works ... i use this as my backup phone. it works very well though it sometimes runs slowly. but it is to be expected for the price point.,1.0
ORD456604,ID0580161464,2019-05-31,Thompson,"[('iAssist Line', 2), ('pearTV', 1), ('Alcon 10', 2)]",28660.0,85.77,-37.7891185,144.9380617,10,25879.77,Autumn,True,2.7391,follow up: i have had this for a month now and would like to follow up on the first review. now that i have learned more about olivia it is a good phone. it is different then my lucent. i would recommend this phone and the seller. i think i said that in my first review. very pleased.,1.0
ORD157108,ID2187975164,2019-08-23,Nickolson,"[('Toshika 750', 1), ('pearTV', 2), ('Candle Inferno', 1)]",17370.0,61.98,-37.8154544,144.9665483,25,13089.48,Winter,False,0.4381,"as expected as described... clean product. no scratches. super on time, delivered a day before ! s4 great upgrade from my s3.",1.0
ORD270449,ID1715989148,2019-09-11,Nickolson,"[('Alcon 10', 2), ('Thunder line', 2), ('Candle Inferno', 2)]",23120.0,95.31,-37.818645000000004,144.9683478,25,17435.31,Spring,True,0.106,great shape great shape! i've had this phone several months and i still don't have problems with it. my only problem is the usb cord that is needed for this is nothing like any other. you might want to consider ordering an extra usb cord for it if you're bad about losing things.,1.0
ORD394252,ID0224753041,2019-05-08,Bakers,"[('iAssist Line', 2), ('Alcon 10', 1)]",13400.0,46.79,-37.808169899999996,144.99169730000003,10,12106.79,Autumn,False,0.3714,two stars camera flash doesn't work and it freezes a lot,0.0
ORD218069,ID0777833057,2019-04-11,Thompson,"[('Alcon 10', 1), ('pearTV', 2), ('Toshika 750', 2), ('iStream', 1)]",30360.0,66.94,-37.8040003,144.9585075,15,25872.94,Autumn,True,1.3943,sending back very large round scratch on glass. sending back. it's too visible.,0.0
ORD236186,ID0576874785,2019-01-28,Bakers,"[('Olivia x460', 2), ('Candle Inferno', 1)]",2880.0,99.85,-37.8241912,144.99006799999995,25,2259.85,Summer,True,1.6441,large screen. great! i am not phone savvy but this phone is easy to figure out.,1.0
ORD107573,ID2187980390,2019-03-24,Nickolson,"[('Candle Inferno', 1), ('Alcon 10', 1), ('iAssist Line', 1)]",11605.0,50.54,-37.813483700000006,144.9656425,0,11655.54,Autumn,False,0.6647,doesn’t connect to internet it doesn’t connect to the internet,0.0
ORD236375,ID6167359485,2019-03-24,Nickolson,"[('Universe Note', 1), ('pearTV', 2)]",16070.0,80.9,-37.812877,144.9740492,0,16150.9,Autumn,True,0.7494,"best phone for the money big screen, light weight, fast ...it’s plastic instead of metal.",1.0
ORD252513,ID0554206042,2019-06-04,Thompson,"[('Thunder line', 2), ('iAssist Line', 1)]",6585.0,81.7,-37.7987409,144.9359,5,6337.45,Winter,True,1.8358,five stars good buy,1.0
ORD344310,ID0844490706,2019-11-12,Thompson,"[('Olivia x460', 2), ('Thunder line', 2), ('Toshika 750', 2)]",15450.0,63.2,-37.8207343,144.94882090000004,5,14740.7,Spring,False,0.9105,mal funcionamiento el artículo llego en buenas condiciones estéticas pero no funciona el face id y la pantalla tiene flashes y cambia de color. no funciona correctamente,0.0
ORD162576,ID0746917828,2019-04-29,Nickolson,"[('Olivia x460', 2), ('iStream', 1), ('Lucent 330S', 2)]",5060.0,81.52,-37.8243871,144.9830569,0,5141.52,Autumn,True,1.3513,i just love my new olivia universe s7 edge i just love my new olivia universe s7 edge. it is much faster than my old olivia universe s4. the screen is beautiful and take great photos.,1.0
ORD226465,ID0577456439,2019-10-27,Bakers,"[('iAssist Line', 2), ('Universe Note', 2), ('Candle Inferno', 1), ('iStream', 1)]",11930.0,69.0,-37.82313,144.98849850000005,25,9016.5,Spring,False,1.5774,"do not buy this phone will suffer from a cracked screen while left completely alone on a counter overnight. manufacturing issues and design flaws abound. waste of money, a total chunk of crap compared to the s7.",0.0
ORD208778,ID1479897566,2019-11-30,Nickolson,"[('iAssist Line', 2), ('Thunder line', 1)]",6630.0,65.95,-37.8201858,144.9578371,0,6695.95,Spring,False,1.0452,fragile glass i'm not sure why olivia thinks it is a good idea to make the back out of such a fragile piece of glass but mine shattered from being dropped two feet on my carpeted floor. maybe they should focus on a durability rather than mimicking pear's terrible designs.,0.0
ORD436573,ID2143829888,2019-09-01,Thompson,"[('pearTV', 2), ('Alcon 10', 2), ('Candle Inferno', 1), ('Olivia x460', 2)]",33400.0,84.33,-37.8026347,144.93523380000005,5,31814.33,Spring,False,1.5271,does great on browsing and doing research easy to use and love the features especially the private browsing a great price as well,1.0
ORD450117,ID0381825173,2019-02-17,Nickolson,"[('Alcon 10', 1), ('iAssist Line', 1)]",11175.0,96.17,-37.8095786,144.97657809999995,10,10153.67,Summer,True,1.1787,i didn't know my phone was refurbish and the picture ... i didn't know my phone was refurbish and the picture of the phone was generic and when i got my phone it had a crack on the top corner.,1.0
ORD445406,ID0780914748,2019-02-27,Thompson,"[('Thunder line', 1), ('Alcon 10', 2), ('Toshika 750', 2)]",28720.0,100.95,-37.800959399999996,144.9566969,5,27384.95,Summer,True,1.5548,four stars wonderful product family member have this phone and she loves it.,1.0
ORD161559,ID0664380046,2019-11-22,Nickolson,"[('Olivia x460', 2), ('Universe Note', 1), ('Alcon 10', 1), ('iAssist Line', 1)]",17075.0,72.76,-37.821223700000004,144.96646769999995,5,16294.01,Spring,False,0.3989,five stars the phone was initiated easily and was just like my last one.,1.0
ORD266876,ID0137180950,2019-11-10,Thompson,"[('iStream', 2), ('Toshika 750', 2), ('Thunder line', 1)]",11120.0,83.87,-37.8031344,144.9619252,15,9535.87,Spring,False,1.6836,great phone i made a good choice 🤗,1.0
ORD110459,ID3967630093,2019-02-17,Thompson,"[('iAssist Line', 2), ('Thunder line', 2)]",8810.0,72.69,-37.818304,144.9524117,25,6680.19,Summer,False,0.7833,five stars love this phone.,1.0
ORD396267,ID0282854611,2019-05-17,Bakers,"[('Thunder line', 2), ('iStream', 2), ('Lucent 330S', 1)]",5890.0,56.84,-37.8035133,145.0193421,10,5357.84,Autumn,False,2.2399,do not buy from open group wireless! make sure you do not buy from open group wireless! even though the model is shown as xt1095 i received an xt1092 which will not work properly (above 2g) on us gms networks! i made the mistake of only looking at reviews after purchasing from them. others have reported the same problem!,0.0
ORD364733,ID0306904051,2019-01-14,Thompson,"[('Alcon 10', 1), ('Lucent 330S', 1), ('Thunder line', 2)]",14540.0,89.48999999999978,-37.8084111,144.9509874,25,10994.49,Summer,True,0.5864,"not an unlocked phone they say it was an unlocked phone, found out it wasn't, i end pay an extra $50 to get it unlocked",1.0
ORD230432,ID4419701256,2019-07-25,Thompson,"[('Thunder line', 1), ('iStream', 2), ('Candle Inferno', 1), ('Universe Note', 1)]",6360.0,68.8,-37.8025675,144.96376909999995,10,5792.8,Winter,True,1.8501,may be defective one suddenly wifi is not working properly and i could see phone feels hot with calls dropping abruptly . i am really not sure of what to do .,0.0
ORD447192,ID4234880956,2019-04-20,Nickolson,"[('Candle Inferno', 2), ('Lucent 330S', 1), ('Olivia x460', 1)]",3315.0,83.69,-37.804274,144.9689013,15,2901.44,Autumn,True,1.5952,great phone that's under the radar great phone that's under the radar. if you are looking for a high quality 4.7 android phone this is your match.,1.0
ORD296379,ID0591306178,2019-01-19,Nickolson,"[('Thunder line', 1), ('pearTV', 1)]",8490.0,77.51,-37.8237,144.9563143,0,8567.51,Summer,False,1.2953,great phone great phone i am still using that and learning more and more about it everyday i still have it and have gone through one case and put a new case on,1.0
ORD232278,ID4716795140,2019-06-16,Thompson,"[('iStream', 1), ('Lucent 330S', 1)]",1380.0,76.52,-37.8172931,144.95326200000005,15,1249.52,Winter,True,0.7491,great speakers camera blue color the best phone for me :d a lot better than the lucent g7,1.0
ORD230230,ID4716795379,2019-04-21,Thompson,"[('Toshika 750', 2), ('Candle Inferno', 2)]",9500.0,77.44,-37.8187852,144.9535325,15,8152.44,Autumn,True,0.8866,great phone for the price the main pros are the price and free shipping. no cons.,1.0
ORD204264,ID0767664999,2019-06-16,Nickolson,"[('Universe Note', 2), ('Lucent 330S', 2)]",9360.0,66.67,-37.8080452,144.97335880000003,10,8490.67,Winter,False,1.2212,"bought a second olivia s5.. i couldn't be more glad. great cell phone.. nice looking, worked as soon as it became active.",1.0
ORD399776,ID0035354279,2019-05-20,Thompson,"[('Lucent 330S', 1), ('Alcon 10', 2), ('iAssist Line', 1), ('Candle Inferno', 1)]",21785.0,80.28,-37.808085399999996,144.9538304,15,18597.53,Autumn,True,0.7838,tough phone great item i’m very hard on phones and this one is tough,1.0
ORD345531,ID1224854774,2019-05-26,Thompson,"[('iAssist Line', 1), ('Universe Note', 1), ('iStream', 2), ('Alcon 10', 2)]",23875.0,65.07,-37.8141705,144.9389406,0,23940.07,Autumn,False,0.7340000000000001,"lumina the best phone i have had. i love windows 8 so easy to operate, and i think the tiles are a lot better than the icons on other operating systems",1.0
ORD469919,ID0277117143,2019-03-19,Nickolson,"[('Lucent 330S', 2), ('Candle Inferno', 1), ('Olivia x460', 1), ('pearTV', 1)]",10425.0,47.92,-37.8219064,144.9753957,0,10472.92,Autumn,False,0.6325,"nice phone, but shipped it back received the phone very quickly, and had no visible damage as described, but did not come with the icc number so i was unable to activate it through my carrier. nice phone, but shipped it back.",0.0
ORD076443,ID0122756701,2019-07-23,Thompson,"[('iAssist Line', 1), ('iStream', 1), ('Thunder line', 2)]",6735.0,64.62,-37.814753,144.94183940000005,15,5789.37,Winter,False,0.5149,"ok, for the price the phone is great for the price i paid. but i only gave it a 3 because it was not unlocked, and i had to jump through hoops to get it unlocked. i've had it for 2 months and the battery life don't compare to the s versions of olivia.",1.0
ORD493765,ID0356085105,2019-03-03,Bakers,"[('Universe Note', 2), ('Thunder line', 2), ('Candle Inferno', 1)]",11690.0,79.56,-37.8146759,145.00156840000002,10,10600.56,Autumn,True,0.7628,five stars great cell phone.,1.0
ORD244869,ID0233315220,2019-12-31,Nickolson,"[('Candle Inferno', 1), ('Toshika 750', 1)]",4750.0,104.02,-37.8008042,144.97482649999995,25,3666.52,Summer,True,2.0340000000000003,purchased for a family member. they love it. would recommend.,1.0
ORD078776,ID1889485053,2019-07-19,Bakers,"[('Thunder line', 2), ('pearTV', 1), ('iAssist Line', 2)]",15120.0,86.48,-37.8158343,145.04645,15,12938.48,Winter,False,4.5509,"beautiful phone everything is good except the weight, little bit heavier and thicker than other phones on the market.",1.0
ORD466909,ID0299029600,2019-05-24,Bakers,"[('pearTV', 1), ('Lucent 330S', 1), ('Candle Inferno', 2)]",8400.0,80.57999999999993,-37.801559600000004,145.00710690000003,15,7220.58,Autumn,True,1.4045,highly recommend i couldn't be happier with my phone. thing is super fast and the battery life is amazing. highly recommend.,1.0
ORD232044,ID0746921972,2019-04-17,Nickolson,"[('Candle Inferno', 1), ('Olivia x460', 1), ('pearTV', 2)]",14275.0,81.14,-37.824162799999996,144.9850543,15,12214.89,Autumn,True,1.4975,"great phone ,just what i needed bought this to replace my old lucentrola phone. love this phone it has all the bells and whistles.... went through the battery really fast until i turned off the location service",1.0
ORD066135,ID0581716579,2019-09-18,Thompson,"[('Toshika 750', 1), ('iStream', 1)]",4470.0,90.73,-37.805207,144.93288909999995,15,3890.23,Spring,True,1.4986,certified refurbished...more like certified crap!! no blemishes on the phone. perfect condition...but a full battery will last me literally an hour and a half with medium battery settings. apps freeze and sometimes don't even open. overall bad performance.,0.0
ORD271166,ID0767724093,2019-08-28,Nickolson,"[('iAssist Line', 2), ('Toshika 750', 1)]",8770.0,70.21000000000004,-37.8046315,144.97239960000005,10,7963.21,Winter,False,1.5744,good value renewed i phone....had some very light small scratches but when put inside a protective case with a screen protector not noticeable at all. works perfectly. arrived with 94% battery capacity remaining.,1.0
ORD422630,ID0641026085,2019-01-28,Thompson,"[('Lucent 330S', 1), ('Universe Note', 1), ('Candle Inferno', 2), ('pearTV', 2)]",18160.0,96.93,-37.8091174,144.9368711,5,17348.93,Summer,True,0.9803,"it’s a good phone and you can’t beat the price it was for a gift , and it was a big hit",1.0
ORD269182,ID2696446373,2019-02-22,Bakers,"[('Alcon 10', 1), ('pearTV', 2), ('Olivia x460', 2), ('Universe Note', 2)]",30920.0,60.32,-37.8117884,144.98443799999995,5,29434.32,Summer,False,0.97,sim card pense que el telefono venia con sim card,0.0
ORD194199,ID3529934912,2019-02-08,Thompson,"[('Universe Note', 2), ('pearTV', 1), ('iAssist Line', 1), ('Lucent 330S', 1)]",16665.0,107.63,-37.8101135,144.9049074,25,12606.38,Summer,True,3.7188,did not care for this product. had difficulty downloading some aps.,0.0
ORD435362,ID0589419755,2019-11-24,Nickolson,"[('pearTV', 1), ('Universe Note', 1), ('Candle Inferno', 1), ('Olivia x460', 1)]",11415.0,103.69,-37.8096703,144.9726776,5,10947.94,Spring,True,1.0308,small device that my kids like to ask questions. very handy friendly interactive,1.0
ORD221362,ID6167417926,2019-10-26,Thompson,"[('Universe Note', 2), ('Olivia x460', 2), ('iAssist Line', 2)]",13800.0,80.34,-37.8155951,144.9580329,25,10430.34,Spring,False,1.0176,great phone! i highly recommend! i've had this phone for a month. absolutely love it!! no issues.,1.0
ORD276300,ID0343337610,2019-12-21,Nickolson,"[('Lucent 330S', 2), ('iStream', 1)]",2610.0,87.14,-37.799163899999996,144.96774380000005,10,2436.14,Summer,False,2.1688,beautiful phone excellent product. it is as described,1.0
ORD227925,ID6167279411,2019-07-19,Nickolson,"[('Alcon 10', 1), ('pearTV', 2), ('Olivia x460', 2), ('iAssist Line', 2)]",28470.0,66.45,-37.81024420000001,144.9621553,15,24265.95,Winter,False,1.1345,doesn't it come with a pen??? where's my pen??? easiest set up and transfer ever. love the phone. just thought it came with the scribble gadget,1.0
ORD116638,ID1152560936,2019-07-28,Thompson,"[('Toshika 750', 1), ('Universe Note', 2)]",11220.0,55.45,-37.798879,144.9516355,0,11275.45,Winter,False,1.5872,"logging in with a password can be difficult since the typed lettersare not shown, even temporarily, so inadvertent typos require guesswork to find.signing out of e-mail is not clear, if it can be done.some ""free"" downloads fail because of lack of payment.allowing for my lack of skills. i was hoping for a little more.it was ok fort basic stuff.",0.0
ORD485927,ID0207085315,2019-05-05,Bakers,"[('pearTV', 2), ('Universe Note', 2)]",19520.0,84.15,-37.8151473,145.0143033,15,16676.15,Autumn,True,1.7725,"i was looking for and cost effective solution to satisfy my childrens desires to have there own smartphone to play games.i like the parental controls, to limit certain actions and downloads.",1.0
ORD275981,ID2270151074,2019-05-25,Bakers,"[('Candle Inferno', 1), ('iAssist Line', 2), ('pearTV', 2)]",17500.0,67.11,-37.813186200000004,145.01425659999995,25,13192.11,Autumn,True,1.7104,one star retail package was a little damage &phone quality okay,0.0
ORD155471,ID0741702160,2019-04-09,Nickolson,"[('Olivia x460', 1), ('Candle Inferno', 1), ('pearTV', 1), ('Toshika 750', 1)]",12285.0,61.49,-37.816767799999994,144.96992450000005,5,11732.24,Autumn,True,0.20600000000000002,"from the first time i used it, the pages kept freezing and didn't respond to touch commands. i had to turn it off and back on daily. i tried to get a replacement and was told they no longer have them and i'd have to pay $10. more for a newer model. i bought 2 (1 as a gift). so far 1 works and 1 didn't.",0.0
ORD305379,ID3215106494,2019-04-30,Thompson,"[('Universe Note', 2), ('Candle Inferno', 1)]",7330.0,51.090000000000146,-37.808273799999995,144.9531472,15,6281.59,Autumn,False,0.725,one star never used. it immediately was a brick,0.0
ORD114206,ID0581736616,2019-03-05,Thompson,"[('pearTV', 1), ('Thunder line', 1), ('Alcon 10', 2)]",26390.0,71.44,-37.8048149,144.9257383,5,25141.94,Autumn,False,2.0699,good phone only down side is the battery life.,1.0
ORD016278,ID6167489475,2019-08-25,Nickolson,"[('iStream', 1), ('Toshika 750', 1), ('Lucent 330S', 1)]",5700.0,77.62,-37.8159653,144.9609759,0,5777.62,Winter,True,0.8089,gold phones are cheaper because nobody cool wants them battery seems to drain kinda fast but should last a full work shift without recgarging,1.0
ORD486212,ID6167344524,2019-08-14,Nickolson,"[('Thunder line', 2), ('iStream', 2)]",4660.0,61.18,-37.8135037,144.96858500000005,25,3556.18,Winter,True,0.5731,battery issue battery needs to be replaced already. just got this phone about a month ago.,0.0
ORD235756,ID6167417916,2019-07-07,Thompson,"[('Toshika 750', 1), ('iStream', 1), ('Alcon 10', 2), ('Candle Inferno', 2)]",23230.0,77.84000000000015,-37.8167794,144.9541952,10,20984.84,Winter,True,0.7757,great phone for this money! awesome phone for this price. only nfc missing. with nfc it would be perfect.,1.0
ORD460657,ID4520380498,2019-08-31,Thompson,"[('iStream', 1), ('Candle Inferno', 1), ('Universe Note', 2)]",7480.0,49.56,-37.810661100000004,144.9559425,25,5659.56,Winter,False,0.8119,"unimpressed i am having significant issues with the phone, it seems to constantly go in and out of connection, drops phone calls, internet is very slow and the speaker and microphone are awful.",0.0
ORD229106,ID0291483918,2019-10-01,Thompson,"[('iAssist Line', 2), ('Universe Note', 2)]",11350.0,71.26,-37.814718400000004,144.950696,5,10853.76,Spring,False,0.3919,"reliable, long lasting my 2nd note series, the 4th in my family. we've owned the note 2, note 3, note 4, and now the note 8. average lifespan of use is over 4 years, so a very good value on the investment.",1.0
ORD460158,ID2797967113,2019-02-04,Nickolson,"[('Toshika 750', 2), ('iStream', 2), ('pearTV', 2), ('Alcon 10', 1)]",30510.0,78.99,-37.8068963,144.9746492,25,22961.49,Summer,False,1.3773,five stars amazing phone with good price! i got this phone win original box with full accessories.,1.0
ORD146079,ID0711369366,2019-04-11,Thompson,"[('Olivia x460', 2), ('Universe Note', 2), ('Thunder line', 1)]",11530.0,66.33,-37.8063468,144.95910659999996,10,10443.33,Autumn,True,1.2715,defective and not unlocked my phone is not unlocked. i try to put it a verizon chip and its not working,0.0
ORD194653,ID0575428932,2019-12-01,Nickolson,"[('Universe Note', 2), ('Candle Inferno', 1), ('Alcon 10', 2)]",25230.0,83.35,-37.819012799999996,144.9846939,25,19005.85,Summer,True,1.3324,it gets the job done...................great to buy......,0.0
ORD125676,ID0387153022,2019-07-26,Thompson,"[('Toshika 750', 1), ('iStream', 2), ('pearTV', 1), ('Alcon 10', 1)]",19880.0,77.39,-37.8063248,144.94233909999997,10,17969.39,Winter,True,0.82,"amazing the cell phone is incredible, it was like new and if i came with the original charger and very well packaged i have no complaints i'm very happy the unpacked was like a new one",1.0
ORD263736,ID2935358339,2019-08-28,Bakers,"[('Toshika 750', 1), ('iStream', 1), ('Candle Inferno', 2), ('Alcon 10', 2)]",23230.0,72.23,-37.8272081,144.99392849999995,10,20979.23,Winter,False,1.9194,five stars unlock and in great condition,1.0
ORD184691,ID0890449075,2019-04-24,Thompson,"[('Alcon 10', 1), ('Olivia x460', 1), ('iStream', 2)]",10475.0,52.38,-37.8006286,144.95480469999995,5,10003.63,Autumn,False,1.5035,"not verizon compatible i ordered a verizon phone, i expected to get a version compatible phone. the product is now worthless to me.",0.0
ORD339225,ID0250479850,2019-02-10,Bakers,"[('iAssist Line', 2), ('Alcon 10', 2)]",22350.0,75.02,-37.815324200000006,145.0075979,5,21307.52,Summer,False,1.2387,i bought two of these digico inferno hd tablets in december as christmas gifts. both recipients are happy with these as gifts. i plan to purchase one in the near future for myself.,1.0
